{
  "$schema": "https://json-schema.org/draft/2020-12/schema",
  "$id": "provenance-1.0",
  "type": "object",
  "additionalProperties": false,
  "required": [
    "schema",
    "sha256",
    "paths",
    "kind",
    "origin",
    "license",
    "authors",
    "derived_from",
    "review",
    "ip_checks",
    "ai_generated",
    "status",
    "created_at"
  ],
  "properties": {
    "schema": {
      "const": "provenance/1.0"
    },
    "sha256": {
      "type": "string",
      "pattern": "^[0-9a-f]{64}$"
    },
    "paths": {
      "type": "array",
      "items": {
        "type": "string"
      },
      "minItems": 1
    },
    "kind": {
      "enum": [
        "character",
        "character_sheet",
        "rig",
        "anim",
        "portrait",
        "mouth_atlas",
        "vehicle",
        "prop",
        "building",
        "terrain",
        "texture",
        "ui",
        "font",
        "audio_music",
        "audio_sfx",
        "audio_bark",
        "voice",
        "cutscene",
        "map_data",
        "world_pack",
        "data"
      ]
    },
    "origin": {
      "enum": [
        "generated",
        "authored",
        "licensed",
        "open_data",
        "derived"
      ]
    },
    "license": {
      "type": "string",
      "minLength": 1
    },
    "attribution": {
      "type": "string"
    },
    "authors": {
      "type": "array",
      "items": {
        "type": "string",
        "pattern": "^(profile|studio):.+"
      }
    },
    "source": {
      "type": "object",
      "additionalProperties": false,
      "required": [
        "url",
        "dataset_id",
        "retrieved"
      ],
      "properties": {
        "url": {
          "type": [
            "string",
            "null"
          ]
        },
        "dataset_id": {
          "type": [
            "string",
            "null"
          ]
        },
        "retrieved": {
          "type": "string"
        }
      }
    },
    "generator": {
      "type": "object",
      "additionalProperties": false,
      "required": [
        "vendor",
        "endpoint",
        "endpoint_registry_key",
        "endpoint_updated_at",
        "request_id",
        "job_key",
        "params_sha256",
        "prompt_template",
        "prompt_sha256",
        "input_refs",
        "terms_snapshot",
        "generated_at",
        "executor",
        "env"
      ],
      "properties": {
        "vendor": {
          "enum": [
            "fal",
            "elevenlabs",
            "minimax",
            "openai",
            "workers_ai",
            "anthropic",
            "local"
          ]
        },
        "endpoint": {
          "type": "string"
        },
        "endpoint_registry_key": {
          "type": "string"
        },
        "endpoint_updated_at": {
          "type": [
            "string",
            "null"
          ]
        },
        "model_version": {
          "type": "string"
        },
        "request_id": {
          "type": "string"
        },
        "seed": {
          "type": "integer"
        },
        "job_key": {
          "type": "string"
        },
        "params_sha256": {
          "type": "string",
          "pattern": "^[0-9a-f]{64}$"
        },
        "prompt_template": {
          "type": "string"
        },
        "prompt_sha256": {
          "type": "string",
          "pattern": "^[0-9a-f]{64}$"
        },
        "negative_prompt_sha256": {
          "type": "string",
          "pattern": "^[0-9a-f]{64}$"
        },
        "expanded_prompt_sha256": {
          "type": "string",
          "pattern": "^[0-9a-f]{64}$"
        },
        "input_refs": {
          "type": "array",
          "items": {
            "type": "string",
            "pattern": "^sha256:[0-9a-f]{64}$"
          }
        },
        "plan": {
          "type": "string"
        },
        "terms_snapshot": {
          "type": "object",
          "additionalProperties": false,
          "required": [
            "path",
            "sha256",
            "checked_at"
          ],
          "properties": {
            "path": {
              "type": "string"
            },
            "sha256": {
              "type": "string",
              "pattern": "^[0-9a-f]{64}$"
            },
            "checked_at": {
              "type": "string"
            }
          }
        },
        "licence_gate": {
          "type": "object",
          "additionalProperties": false,
          "required": [
            "gate",
            "status"
          ],
          "properties": {
            "gate": {
              "const": "ADR-GENAI-01"
            },
            "status": {
              "enum": [
                "cleared",
                "pending",
                "blocked"
              ]
            },
            "evidence": {
              "type": "string"
            }
          }
        },
        "cost_usd_micros": {
          "type": "integer",
          "minimum": 0
        },
        "generated_at": {
          "type": "string"
        },
        "executor": {
          "enum": [
            "workflow",
            "cli",
            "mock"
          ]
        },
        "env": {
          "enum": [
            "production",
            "previs",
            "test"
          ]
        }
      }
    },
    "derived_from": {
      "type": "array",
      "items": {
        "type": "string",
        "pattern": "^(sha256:)?[0-9a-f]{64}$"
      }
    },
    "tool": {
      "type": "object",
      "additionalProperties": false,
      "required": [
        "name",
        "version",
        "args_sha256"
      ],
      "properties": {
        "name": {
          "type": "string"
        },
        "version": {
          "type": "string"
        },
        "args_sha256": {
          "type": "string",
          "pattern": "^[0-9a-f]{64}$"
        }
      }
    },
    "likeness": {
      "type": "object",
      "additionalProperties": false,
      "required": [
        "subject_id",
        "tier",
        "face_reference_used",
        "voice_mode",
        "photoreal"
      ],
      "properties": {
        "subject_id": {
          "type": [
            "string",
            "null"
          ]
        },
        "tier": {
          "enum": [
            "consented",
            "parody",
            "fictionalized",
            "original"
          ]
        },
        "face_reference_used": {
          "type": "boolean"
        },
        "voice_mode": {
          "enum": [
            "none",
            "synthetic",
            "designed",
            "consented_clone",
            "licensed"
          ]
        },
        "consent_record_id": {
          "type": "string"
        },
        "consent_scopes_used": {
          "type": "array",
          "items": {
            "type": "string"
          }
        },
        "photoreal": {
          "type": "boolean"
        }
      }
    },
    "review": {
      "type": "array",
      "items": {
        "type": "object",
        "additionalProperties": false,
        "required": [
          "gate",
          "by",
          "at",
          "decision"
        ],
        "properties": {
          "gate": {
            "type": "string"
          },
          "by": {
            "type": "string"
          },
          "at": {
            "type": "string"
          },
          "decision": {
            "enum": [
              "approve",
              "reject"
            ]
          },
          "note": {
            "type": "string"
          }
        }
      }
    },
    "ip_checks": {
      "type": "object",
      "additionalProperties": false,
      "required": [
        "signatures",
        "strings",
        "similarity"
      ],
      "properties": {
        "signatures": {
          "enum": [
            "pass",
            "n/a"
          ]
        },
        "strings": {
          "enum": [
            "pass",
            "n/a"
          ]
        },
        "similarity": {
          "enum": [
            "pass",
            "n/a"
          ]
        },
        "vision": {
          "enum": [
            "pass",
            "review"
          ]
        }
      }
    },
    "ai_generated": {
      "type": "boolean"
    },
    "c2pa": {
      "enum": [
        "valid",
        "valid-untrusted",
        "absent",
        "invalid",
        "resigned"
      ]
    },
    "status": {
      "enum": [
        "active",
        "quarantined",
        "killed"
      ]
    },
    "created_at": {
      "type": "string",
      "pattern": "^\\d{4}-\\d{2}-\\d{2}T\\d{2}:\\d{2}:\\d{2}(\\.\\d+)?Z$"
    }
  },
  "allOf": [
    {
      "if": {
        "properties": {
          "origin": {
            "const": "generated"
          }
        }
      },
      "then": {
        "required": [
          "generator"
        ],
        "properties": {
          "ai_generated": {
            "const": true
          }
        }
      }
    },
    {
      "if": {
        "properties": {
          "origin": {
            "const": "licensed"
          }
        }
      },
      "then": {
        "required": [
          "source"
        ]
      }
    },
    {
      "if": {
        "properties": {
          "origin": {
            "const": "open_data"
          }
        }
      },
      "then": {
        "required": [
          "source",
          "attribution"
        ]
      }
    },
    {
      "if": {
        "properties": {
          "origin": {
            "const": "derived"
          }
        }
      },
      "then": {
        "required": [
          "tool"
        ],
        "properties": {
          "derived_from": {
            "minItems": 1
          }
        }
      }
    },
    {
      "if": {
        "properties": {
          "kind": {
            "enum": [
              "character",
              "character_sheet",
              "rig",
              "anim",
              "portrait",
              "mouth_atlas",
              "voice",
              "audio_bark",
              "cutscene"
            ]
          }
        }
      },
      "then": {
        "required": [
          "likeness"
        ]
      }
    },
    {
      "if": {
        "required": [
          "likeness"
        ],
        "properties": {
          "likeness": {
            "properties": {
              "tier": {
                "enum": [
                  "parody",
                  "fictionalized",
                  "original"
                ]
              }
            }
          }
        }
      },
      "then": {
        "properties": {
          "likeness": {
            "properties": {
              "face_reference_used": {
                "const": false
              },
              "photoreal": {
                "const": false
              },
              "voice_mode": {
                "enum": [
                  "none",
                  "synthetic",
                  "designed"
                ]
              }
            }
          }
        }
      }
    },
    {
      "if": {
        "required": [
          "likeness"
        ],
        "properties": {
          "likeness": {
            "properties": {
              "tier": {
                "const": "consented"
              }
            }
          }
        }
      },
      "then": {
        "properties": {
          "likeness": {
            "required": [
              "consent_record_id"
            ]
          }
        }
      }
    }
  ]
}
