{
  "schema": "provenance/1.0",
  "sha256": "d150e71af71b9b0e134e86f6530539e0a1a363f10ed2f1b73cb9299a2d8d482d",
  "paths": [
    "assets/src/vehicle/robotaxi.default/desktop.glb"
  ],
  "kind": "vehicle",
  "origin": "authored",
  "license": "LicenseRef-DeeVerse-Owned",
  "authors": [
    "studio:dee-verse"
  ],
  "derived_from": [],
  "tool": {
    "name": "tools/assets vehicle",
    "version": "1.0.0",
    "args_sha256": "5d72c79e80eec49f633dfd9ad8aec5dff0ab0c771fc20be21c689b54b286a16a"
  },
  "review": [],
  "ip_checks": {
    "signatures": "pass",
    "strings": "n/a",
    "similarity": "n/a"
  },
  "ai_generated": false,
  "status": "active",
  "created_at": "2026-10-29T00:00:00Z"
}
