{
  "schema": "provenance/1.0",
  "sha256": "33628805282acbcad0accaf681ae2e339c665c708acae595c65c5ec43a89220a",
  "paths": [
    "assets/src/prop/ped.far.a/mobile.glb"
  ],
  "kind": "prop",
  "origin": "authored",
  "license": "LicenseRef-DeeVerse-Owned",
  "authors": [
    "studio:dee-verse"
  ],
  "derived_from": [],
  "tool": {
    "name": "tools/assets people",
    "version": "1.0.0",
    "args_sha256": "7df4a200a6acc61a1e7deeec804bf407da2ad3b22b4b455c3bfb762586b7fbf9"
  },
  "review": [],
  "ip_checks": {
    "signatures": "pass",
    "strings": "n/a",
    "similarity": "n/a"
  },
  "ai_generated": false,
  "status": "active",
  "created_at": "2026-10-30T00:00:00Z"
}
