{
  "schema": "provenance/1.0",
  "sha256": "a50b46e7a55aa45062a2d535c64e446be05d2568de9f7fc66882180df5fd3eb7",
  "paths": [
    "tests/fixtures/cutscenes/fixture-b/poster.webp"
  ],
  "kind": "cutscene",
  "origin": "authored",
  "license": "LicenseRef-DeeVerse-Owned",
  "authors": [
    "studio:dee-verse"
  ],
  "derived_from": [],
  "tool": {
    "name": "tests/fixtures/cutscenes/make-fixtures.ts",
    "version": "1.0.0",
    "args_sha256": "619bc82db3a5661c09653746156e7175c84f022ea073ffe2ee2cf72945204329"
  },
  "review": [],
  "ip_checks": {
    "signatures": "pass",
    "strings": "n/a",
    "similarity": "n/a"
  },
  "ai_generated": false,
  "status": "active",
  "created_at": "2026-10-22T00:00:00Z"
}
