{
  "schema": "provenance/1.0",
  "sha256": "7c2d47912840616c538b1ae5e6e422a585983a5886fd033d02f075123b68e7d0",
  "paths": [
    "assets/src/character/pc-body-solid/mobile-low.glb"
  ],
  "kind": "character",
  "origin": "authored",
  "license": "LicenseRef-DeeVerse-Owned",
  "authors": [
    "studio:dee-verse"
  ],
  "derived_from": [],
  "tool": {
    "name": "tools/assets people",
    "version": "1.0.0",
    "args_sha256": "7f2fe88ea5c7ed59a03526744491b3846bd996a62bd219f8bf0e68fdea4835e7"
  },
  "likeness": {
    "subject_id": null,
    "tier": "original",
    "face_reference_used": false,
    "voice_mode": "none",
    "photoreal": false
  },
  "review": [],
  "ip_checks": {
    "signatures": "pass",
    "strings": "n/a",
    "similarity": "n/a"
  },
  "ai_generated": false,
  "status": "active",
  "created_at": "2026-10-30T00:00:00Z"
}
