{
  "schema": "provenance/1.0",
  "sha256": "2be4d0e60bdcdc9fca6e53faa4ada9000721ff58f19a49cbd823afee96eaff9d",
  "paths": [
    "assets/src/character/ped.outfit.10/mobile.glb"
  ],
  "kind": "character",
  "origin": "authored",
  "license": "LicenseRef-DeeVerse-Owned",
  "authors": [
    "studio:dee-verse"
  ],
  "derived_from": [],
  "tool": {
    "name": "tools/assets people",
    "version": "1.0.0",
    "args_sha256": "40bfa9236be99583c826d2ba14b44d7543d9ac29ff68401631194a9520b9381b"
  },
  "likeness": {
    "subject_id": null,
    "tier": "original",
    "face_reference_used": false,
    "voice_mode": "none",
    "photoreal": false
  },
  "review": [],
  "ip_checks": {
    "signatures": "pass",
    "strings": "n/a",
    "similarity": "n/a"
  },
  "ai_generated": false,
  "status": "active",
  "created_at": "2026-10-30T00:00:00Z"
}
