{
  "schema": "provenance/1.0",
  "sha256": "4e9a4bfc83c54f2537b3d04199a56f47cdf3ed9a151860b0e8b662a9f45422dc",
  "paths": [
    "assets/src/character/pc-top-tank/mobile.glb"
  ],
  "kind": "character",
  "origin": "authored",
  "license": "LicenseRef-DeeVerse-Owned",
  "authors": [
    "studio:dee-verse"
  ],
  "derived_from": [],
  "tool": {
    "name": "tools/assets people",
    "version": "1.0.0",
    "args_sha256": "469f85046c9bece5a46a64c6736300610f215e70388b38645a02606414a96435"
  },
  "likeness": {
    "subject_id": null,
    "tier": "original",
    "face_reference_used": false,
    "voice_mode": "none",
    "photoreal": false
  },
  "review": [],
  "ip_checks": {
    "signatures": "pass",
    "strings": "n/a",
    "similarity": "n/a"
  },
  "ai_generated": false,
  "status": "active",
  "created_at": "2026-10-30T00:00:00Z"
}
