{
  "schema": "provenance/1.0",
  "sha256": "2e7b3833b99b56061cade5705c78fe489ef20c07630ab92528bc71161a374b94",
  "paths": [
    "assets/src/character/ped.body.f/mobile-low.glb"
  ],
  "kind": "character",
  "origin": "authored",
  "license": "LicenseRef-DeeVerse-Owned",
  "authors": [
    "studio:dee-verse"
  ],
  "derived_from": [],
  "tool": {
    "name": "tools/assets people",
    "version": "1.0.0",
    "args_sha256": "18e8e276ab4d078b3936935f0357ae4f396e2ae3eb304844cf44977b700fc0a3"
  },
  "likeness": {
    "subject_id": null,
    "tier": "original",
    "face_reference_used": false,
    "voice_mode": "none",
    "photoreal": false
  },
  "review": [],
  "ip_checks": {
    "signatures": "pass",
    "strings": "n/a",
    "similarity": "n/a"
  },
  "ai_generated": false,
  "status": "active",
  "created_at": "2026-10-30T00:00:00Z"
}
