{
  "schema": "provenance/1.0",
  "sha256": "4010045b5e26b757f135494d7d225d6e916cb972d7ba358ce1f959c07dfe79ef",
  "paths": [
    "assets/src/portrait/pc-top-raincoat/default.png"
  ],
  "kind": "portrait",
  "origin": "derived",
  "license": "LicenseRef-DeeVerse-Owned",
  "authors": [
    "studio:dee-verse"
  ],
  "derived_from": [
    "3297b437c253605faeeb87a6e9dd3c2f3891a2b39d511c56320e0dee2ff6ae79"
  ],
  "tool": {
    "name": "tools/assets people",
    "version": "1.0.0",
    "args_sha256": "aa51d0407cc3902ddd70dd051a25e731fb8540d793266b695456158b3790e5c6"
  },
  "likeness": {
    "subject_id": null,
    "tier": "original",
    "face_reference_used": false,
    "voice_mode": "none",
    "photoreal": false
  },
  "review": [],
  "ip_checks": {
    "signatures": "n/a",
    "strings": "n/a",
    "similarity": "n/a"
  },
  "ai_generated": false,
  "status": "active",
  "created_at": "2026-10-30T00:00:00Z"
}
