{
  "schema": "provenance/1.0",
  "sha256": "ea3d8848b4d8ca17ceb9fcef9be70e405851b13357bce6c2752a71c3e4f157b3",
  "paths": [
    "assets/src/data/mission.m.a1.07/mission.json"
  ],
  "kind": "data",
  "origin": "authored",
  "license": "LicenseRef-DeeVerse-Owned",
  "authors": [
    "studio:dee-verse"
  ],
  "derived_from": [],
  "review": [],
  "ip_checks": {
    "signatures": "pass",
    "strings": "n/a",
    "similarity": "n/a"
  },
  "ai_generated": false,
  "status": "active",
  "created_at": "2026-10-24T11:54:48Z"
}
