{
  "schema": "provenance/1.0",
  "sha256": "dece33d00a47d3f0c38d6f3e699c1bb8a814c8675cfb3c03819a72c68291d3a5",
  "paths": [
    "assets/src/texture/pbr.grass-dirt.albedo/desktop.ktx2"
  ],
  "kind": "texture",
  "origin": "derived",
  "license": "CC0-1.0",
  "authors": [
    "profile:charlotte-baglioni"
  ],
  "derived_from": [
    "fbab95206455b849677a07372ea2050956afbb559d9da6db946e3e6c02aae6a1"
  ],
  "review": [],
  "ip_checks": {
    "signatures": "pass",
    "strings": "pass",
    "similarity": "n/a"
  },
  "ai_generated": false,
  "status": "active",
  "created_at": "2026-10-28T00:00:00Z",
  "tool": {
    "name": "dv-texture-set",
    "version": "ktx2-encoder@0.6.0 (basis_universal)",
    "args_sha256": "320dbbcd5c8eedefb3735d4d18bbbd89abfb991d030e3cbf0f57fd3d301b3506"
  }
}
