{
  "schema": "provenance/1.0",
  "sha256": "03c8bd52fba292c50105b0c27a3bca287052707ef53a4862a605221ce10ea67b",
  "paths": [
    "assets/src/portrait/pc-hair-afro/default.png"
  ],
  "kind": "portrait",
  "origin": "derived",
  "license": "LicenseRef-DeeVerse-Owned",
  "authors": [
    "studio:dee-verse"
  ],
  "derived_from": [
    "55059134d17aa93fa6c46daaf50ca85250e7e6974ab9dd62bafe5ff7246bac06"
  ],
  "tool": {
    "name": "tools/assets people",
    "version": "1.0.0",
    "args_sha256": "0932322cac6ed242b07d398bc6038b895aa67e656919a5017038a32486775c79"
  },
  "likeness": {
    "subject_id": null,
    "tier": "original",
    "face_reference_used": false,
    "voice_mode": "none",
    "photoreal": false
  },
  "review": [],
  "ip_checks": {
    "signatures": "n/a",
    "strings": "n/a",
    "similarity": "n/a"
  },
  "ai_generated": false,
  "status": "active",
  "created_at": "2026-10-30T00:00:00Z"
}
