{
  "ai_generated": false,
  "authors": [
    "studio:dee-verse"
  ],
  "created_at": "2026-10-25T00:00:00Z",
  "derived_from": [],
  "ip_checks": {
    "signatures": "n/a",
    "strings": "n/a",
    "similarity": "n/a"
  },
  "kind": "character",
  "license": "LicenseRef-DeeVerse-Owned",
  "likeness": {
    "subject_id": null,
    "tier": "original",
    "face_reference_used": false,
    "voice_mode": "none",
    "photoreal": false
  },
  "origin": "authored",
  "paths": [
    "assets/src/character/graybox.influencer/default.glb"
  ],
  "review": [],
  "schema": "provenance/1.0",
  "sha256": "a48a3757c147431293fcb7cd0c097b9675ec8e2dab237ccf7432eaa014648598",
  "status": "active"
}
