{
  "schema": "provenance/1.0",
  "sha256": "d293e09ab5153e35459e619d97ba4be41e50a88cc3362af335139b1038855bd3",
  "paths": [
    "assets/src/character/ped.outfit.20/mobile-low.glb"
  ],
  "kind": "character",
  "origin": "authored",
  "license": "LicenseRef-DeeVerse-Owned",
  "authors": [
    "studio:dee-verse"
  ],
  "derived_from": [],
  "tool": {
    "name": "tools/assets people",
    "version": "1.0.0",
    "args_sha256": "5f0bc55159b97b5d2872e3c6f2487970977537aa94a4d61d225e1780ea684e91"
  },
  "likeness": {
    "subject_id": null,
    "tier": "original",
    "face_reference_used": false,
    "voice_mode": "none",
    "photoreal": false
  },
  "review": [],
  "ip_checks": {
    "signatures": "pass",
    "strings": "n/a",
    "similarity": "n/a"
  },
  "ai_generated": false,
  "status": "active",
  "created_at": "2026-10-30T00:00:00Z"
}
