{
  "schema": "provenance/1.0",
  "sha256": "806e5a47678441131ca1362b57dbc2e0fc2d5cf9bf1cd92dbf4912ecf2ac3fac",
  "paths": [
    "assets/src/portrait/pc-body-long/default.png"
  ],
  "kind": "portrait",
  "origin": "derived",
  "license": "LicenseRef-DeeVerse-Owned",
  "authors": [
    "studio:dee-verse"
  ],
  "derived_from": [
    "21773b8df2d31e4a5cc7f658c70f4a293ca95a9fdf46dde3e0ae26a1b00e2033"
  ],
  "tool": {
    "name": "tools/assets people",
    "version": "1.0.0",
    "args_sha256": "ffe6d680eec61c2d9b168ff99a8658300d6702ecbd3971bd2aef86eff3db05cd"
  },
  "likeness": {
    "subject_id": null,
    "tier": "original",
    "face_reference_used": false,
    "voice_mode": "none",
    "photoreal": false
  },
  "review": [],
  "ip_checks": {
    "signatures": "n/a",
    "strings": "n/a",
    "similarity": "n/a"
  },
  "ai_generated": false,
  "status": "active",
  "created_at": "2026-10-30T00:00:00Z"
}
